{
  "id": "ex.nt.modular-inverse-check",
  "entity_type": "example",
  "schema_version": "1.0.0",
  "status": "published",
  "example_kind": "worked-example",
  "primary_topic_id": "nt.congruences-modular-arithmetic",
  "title": "Find the Inverse of 7 Modulo 20",
  "slug": "find-inverse-of-7-modulo-20",
  "prompt": {
    "source_format": "markdown",
    "plain_text": "Find an integer x such that 7x ≡ 1 mod 20.",
    "markdown": "Find an integer $x$ such that $7x \\equiv 1 \\pmod{20}$."
  },
  "solution_id": "sol.nt.modular-inverse-check",
  "tracking_profile": {
    "is_trackable": true,
    "mastery_weight": 0.5,
    "review_priority": "normal",
    "completion_criteria": ["understand", "apply", "review"],
    "estimated_effort_minutes": 10
  },
  "objective": {
    "source_format": "markdown",
    "plain_text": "Use small residue checks to confirm invertibility and identify a modular inverse quickly.",
    "markdown": "Use small residue checks to confirm invertibility and identify a modular inverse quickly."
  },
  "used_definition_ids": ["def.nt.congruence-modulo-n"],
  "used_technique_ids": ["tech.nt.reduce-modulo-structure"],
  "related_problem_ids": ["prob.nt.remainder-7-power-100-mod-13"],
  "final_result": {
    "source_format": "dual",
    "plain_text": "7^-1 ≡ 3 mod 20 because 7*3 = 21 ≡ 1 mod 20.",
    "markdown": "$7^{-1} \\equiv 3 \\pmod{20}$ because $7\\cdot3 = 21 \\equiv 1 \\pmod{20}$.",
    "latex": "7^{-1}\\equiv 3 \\pmod{20}"
  },
  "audit": {
    "created_at": "2026-03-09T08:14:00Z",
    "updated_at": "2026-03-09T08:14:00Z",
    "created_by": "seed.bot",
    "updated_by": "seed.bot"
  }
}
